"TITLE";"STATUS";"SLUG";"LONG DESCRIPTION";"TYPE";"ADDITIONALTYPES";"PRICE";"PRICERANGE";"INSTOCK";"SOLDCOUNT";"AVAILABLESINCE";"LASTCHECKEDAT";"IMAGE";"DISCOUNTS";"ARTICLENUMBERS";"ARTICLECATEGORY";"DIMENSIONS";"COLORS"
"Rustic Granite Chips";"Published";"eveniet-quaerat-nihil";"The beautiful range of Apple Naturalé that has an exciting mix of natural ingredients. With the Goodness of 100% Natural Ingredients";"Shoes";"[""Socks"",""Cap""]";"779";"{""min"":623.2,""max"":934.8}";"false";"932";"Sun Sep 08 2024 18:52:35 GMT+0200 (Central European Summer Time)";"Thu Jan 09 2025 11:10:45 GMT+0100 (Central European Standard Time)";"https://images.unsplash.com/photo-1601987078505-d93c4cc17b5e";"[{""quantity"":46,""price"":340},{""quantity"":85,""price"":216}]";"[null]";"Apparel";"{""width"":35.92,""height"":82.22,""depth"":18.38}";"[{""hex"":""#7FFFD4"",""name"":""Aquamarine""},{""hex"":""#8B0000"",""name"":""DarkRed""}]"
"Rustic Concrete Sausages";"Published";"omnis-eos-mollitia";"Ergonomic executive chair upholstered in bonded black leather and PVC padded seat and back for all-day comfort and support";"Mug";"[]";"138";"{""min"":110.4,""max"":165.6}";"true";"853";"Tue Mar 19 2024 13:51:02 GMT+0100 (Central European Standard Time)";"Thu Jan 09 2025 11:10:45 GMT+0100 (Central European Standard Time)";"https://images.unsplash.com/photo-1601987078505-d93c4cc17b5e";"[{""quantity"":69,""price"":147}]";"[null,null,null]";"Office";"{""width"":64.53,""height"":51.37,""depth"":28.18}";"[{""hex"":""#C0C0C0"",""name"":""Silver""}]"
"Practical Plastic Pizza";"Deleted";"animi-in-tempora";"Carbonite web goalkeeper gloves are ergonomically designed to give easy fit";"Shoes";"[""Jacket"",""Pants""]";"360";"{""min"":288,""max"":432}";"false";"120";"Sun Apr 28 2024 05:02:38 GMT+0200 (Central European Summer Time)";"Thu Jan 09 2025 11:10:45 GMT+0100 (Central European Standard Time)";"https://images.unsplash.com/photo-1601987078505-d93c4cc17b5e";"[{""quantity"":42,""price"":781},{""quantity"":35,""price"":660}]";"[null,null]";"Apparel";"{""width"":30.33,""height"":76.12,""depth"":32.3}";"[{""hex"":""#7FFF00"",""name"":""Chartreuse""},{""hex"":""#A9A9A9"",""name"":""DarkGray""},{""hex"":""#808000"",""name"":""Olive""}]"
"Gorgeous Granite Bike";"Published";"eos-corrupti-explicabo";"Boston's most advanced compression wear technology increases muscle oxygenation, stabilizes active muscles";"Mug";"[]";"943";"{""min"":754.4000000000001,""max"":1131.6}";"true";"134";"Mon Oct 21 2024 15:47:46 GMT+0200 (Central European Summer Time)";"Thu Jan 09 2025 11:10:45 GMT+0100 (Central European Standard Time)";"https://images.unsplash.com/photo-1601987078505-d93c4cc17b5e";"[{""quantity"":2,""price"":640},{""quantity"":7,""price"":434}]";"[null]";"Office";"{""width"":15.83,""height"":48.18,""depth"":48.27}";"[{""hex"":""#C0C0C0"",""name"":""Silver""},{""hex"":""#800000"",""name"":""Maroon""},{""hex"":""#F0F8FF"",""name"":""AliceBlue""},{""hex"":""#FF0000"",""name"":""Red""}]"
"Refined Wooden Keyboard";"Published";"cum-sit-harum";"Carbonite web goalkeeper gloves are ergonomically designed to give easy fit";"Notebook";"[""Calendar"",""Pen""]";"404";"{""min"":323.20000000000005,""max"":484.79999999999995}";"true";"159";"Sun Aug 18 2024 07:36:19 GMT+0200 (Central European Summer Time)";"Thu Jan 09 2025 11:10:45 GMT+0100 (Central European Standard Time)";"https://images.unsplash.com/photo-1601987078505-d93c4cc17b5e";"[{""quantity"":68,""price"":83}]";"[null,null,null]";"Office";"{""width"":6.53,""height"":25.68,""depth"":6.9}";"[{""hex"":""#8B0000"",""name"":""DarkRed""},{""hex"":""#FFFFFF"",""name"":""White""},{""hex"":""#F0FFFF"",""name"":""Azure""},{""hex"":""#2F4F4F"",""name"":""DarkSlateGray""}]"
